{
  "schema": "acceptance-context.v1",
  "user_request": "Complete Plan Brief MVP in 5 tasks",
  "user_request_hash": "0123456789abcdef0123456789abcdef0123456789abcdef0123456789abcdef",
  "demo_artifacts": [
    { "kind": "screenshot", "path": ".claude/state/views/plan-brief-2026-05-09T08-55-00.html" },
    { "kind": "text",       "path": "output log of tests/test-plan-brief-e2e.sh" }
  ],
  "verified_criteria": [
    { "name": "AC-1: SKILL.md exists",       "passed": true, "evidence": "skills/harness-plan-brief/SKILL.md (commit b523dee1)" },
    { "name": "AC-2: project enforcement", "passed": true, "evidence": "test-harness-plan-brief.sh PASS" },
    { "name": "AC-3: cross-project forbidden",  "passed": true, "evidence": "grep confirms cross-project only in restricted context" },
    { "name": "AC-4: JSON Schema validity",  "passed": true, "evidence": "validated with Python jsonschema" },
    { "name": "AC-5: e2e end-to-end verification",        "passed": true, "evidence": "test-plan-brief-e2e.sh 29/29 PASS" }
  ],
  "unverified_caveats": [],
  "past_issue_patterns": [
    { "pattern_id": "P5",  "title": "Hook script template",      "verified_in_current_task": true },
    { "pattern_id": "P29", "title": "dual hooks.json sync",      "verified_in_current_task": true }
  ],
  "recommendation": "ship",
  "recommendation_evidence": [
    "verified 5 / 5 total (100%) -> at or above ship threshold (>= 0.8)",
    "all unverified caveats are 0, no residual risk",
    "both past issue patterns verified in the current task"
  ],
  "project": "harness",
  "generated_at": "2026-05-09T18:30:00Z",
  "verified_criteria_items": [
    { "name": "AC-1: SKILL.md exists",       "status_label": "passed", "evidence": "skills/harness-plan-brief/SKILL.md (commit b523dee1)", "evidence_warn": "" },
    { "name": "AC-2: project enforcement", "status_label": "passed", "evidence": "test-harness-plan-brief.sh PASS", "evidence_warn": "" },
    { "name": "AC-3: cross-project forbidden",  "status_label": "passed", "evidence": "grep confirms cross-project only in restricted context", "evidence_warn": "" },
    { "name": "AC-4: JSON Schema validity",  "status_label": "passed", "evidence": "validated with Python jsonschema", "evidence_warn": "" },
    { "name": "AC-5: e2e end-to-end verification",        "status_label": "passed", "evidence": "test-plan-brief-e2e.sh 29/29 PASS", "evidence_warn": "" }
  ],
  "unverified_caveats_items": [],
  "recommendation_evidence_items": [
    { "text": "verified 5 / 5 total (100%) -> at or above ship threshold (>= 0.8)" },
    { "text": "all unverified caveats are 0, no residual risk" },
    { "text": "both past issue patterns verified in the current task" }
  ]
}
